{
    "name": "Light",
    "colorSeeds": {
        "colorPrimaryBase": "#0066FF",
        "colorPrimaryNavBase": "#0059B3",
        "colorSuccessBase": "#32CE99",
        "colorWarningBase": "#ED7B2F",
        "colorErrorBase": "#CC1423",
        "colorTextBase": "#000000",
        "colorBgBase": "#FFFFFF"
    },
    "colors": {
        "colorPrimaryBase": "#0066FF",
        "colorPrimaryBg": "#F0F7FF",
        "colorPrimaryBgActive": "#D6E8FF",
        "colorPrimaryDisabled": "#BDDAFF",
        "colorPrimaryBorder": "#6BB0FF",
        "colorPrimaryBgHover": "#2986FF",
        "colorPrimary": "#0066FF",
        "colorPrimaryActive": "#004FD9",
        "colorPrimaryGradient": "#00000000",
        "colorPrimaryNavBase": "#0059B3",
        "colorPrimaryNav": "#0059B3",
        "colorPrimaryNavRev": "#CCFFFFFF",
        "colorPrimaryNavSecondaryRev": "#A6FFFFFF",
        "colorPrimaryNavTertiaryRev": "#66FFFFFF",
        "colorPrimaryNavQuaternaryRev": "#40FFFFFF",

        "colorSuccessBase": "#32CE99",
        "colorSuccessBg": "#F0FFF7",
        "colorSuccessBgActive": "#E0FFF1",
        "colorSuccessDisabled": "#B0F5D7",
        "colorSuccessBorder": "#82E8BF",
        "colorSuccessHover": "#58DBAB",
        "colorSuccess": "#32CE99",
        "colorSuccessActive": "#20A87F",
        "colorSuccessGradient": "#00000000",
        "colorWarningBase": "#ED7B2F",
        "colorWarningBg": "#FFF8F0",
        "colorWarningBgActive": "#FFECD6",
        "colorWarningDisabled": "#FFD6AD",
        "colorWarningBorder": "#FFBE85",
        "colorWarningHover": "#FA9F5A",
        "colorWarning": "#ED7B2F",
        "colorWarningActive": "#CE5C1E",
        "colorWarningGradient": "#00000000",
        "colorErrorBase": "#CC1423",
        "colorErrorBg": "#FFF1F0",
        "colorErrorBgActive": "#FFE0E0",
        "colorErrorDisabled": "#FFC8C7",
        "colorErrorBorder": "#FF9EA0",
        "colorErrorHover": "#D93840",
        "colorError": "#CC1423",
        "colorErrorActive": "#A6081B",
        "colorErrorGradient": "#00000000",

        "colorTextBase": "#000000",
        "colorText": "#E0000000",
        "colorTextSecondary": "#A6000000",
        "colorTextTertiary": "#66000000",
        "colorTextQuaternary": "#40000000",
        "colorTextRev": "#E0FFFFFF",
        "colorTextSecondaryRev": "#A6FFFFFF",
        "colorTextTertiaryRev": "#66FFFFFF",
        "colorTextQuaternaryRev": "#40FFFFFF",

        "colorBgBase": "#FFFFFF",
        "colorFill": "#FFFFFFFF",
        "colorFillSecondary": "#FAFAFC",
        "colorFillTertiary": "#EEEEF0",
        "colorFillQuaternary": "#BEBEC0",
        "colorFillHover": "#0D000000",
        "colorFillSecondaryHover": "#1A000000",
        "colorFillTertiaryHover": "#33000000",
        "colorFillQuaternaryHover": "#66000000",
        "colorBgContainer": "#FFFFFFFF",
        "colorBgContainerSecondary": "#FAFAFC",
        "colorBgContainerTertiary": "#F4F4F6",
        "colorBgContainerQuaternary": "#EEEEF0",
        "colorBgContainerQuinary": "#58585A",
        "colorBgRender": "#FFFFFFFF",
        "colorBgRenderSecondary": "#A6FFFFFF",
        "colorBgRenderTertiary": "#66FFFFFF",
        "colorBgRenderQuaternary": "#1AFFFFFF",
        "colorBorder": "#D8D8DA",
        "colorBorderSecondary": "#BEBEC0",
        "colorDivider": "#E3E3E6",
        "colorDividerSecondary": "#D8D8DA",
        "colorDividerTertiary": "#8C8C8E",

        "OnAccent": "#FFFFFFFF",
        "OnAccentSecondary": "#D6E8FF",
        "Focus": "#0066FF",
        "Selection": "#D6E8FF",
        "Link": "#0066FF",
        "Scrim": "#4D000000",
        "Overlay": "#E6FFFFFF",
        "Shadow": "#1A000000",
        "Separator": "#D8D8DA"
    },
    "fonts": {
        "fontWeightRegular": 400,
        "fontWeightMedium": 500,
        "fontWeightBold": 700,
        "fontItalic": false,
        "fontLineHeight": 1.4,
        "fontLetterSpacing": 0,
        "fontSizeBase": 12
    }
}