{
    "name": "Dark",
    "colorSeeds": {
        "colorPrimaryBase": "#0066FF",
        "colorPrimaryNavBase": "#1E1E1E",
        "colorSuccessBase": "#32CE99",
        "colorWarningBase": "#ED7B2F",
        "colorErrorBase": "#CC1423",
        "colorTextBase": "#FFFFFF",
        "colorBgBase": "#000000"
    },
    "colors": {
        "colorPrimaryBase": "#0066FF",
        "colorPrimaryBg": "#3B444F",
        "colorPrimaryBgActive": "#334966",
        "colorPrimaryDisabled": "#27508D",
        "colorPrimaryBorder": "#1658BC",
        "colorPrimaryBgHover": "#2986FF",
        "colorPrimary": "#0066FF",
        "colorPrimaryActive": "#004FD9",
        "colorPrimaryGradient": "#00000000",
        "colorPrimaryNavBase": "#1E1E1E",
        "colorPrimaryNav": "#1E1E1E",
        "colorPrimaryNavRev": "#CCFFFFFF",
        "colorPrimaryNavSecondaryRev": "#A6FFFFFF",
        "colorPrimaryNavTertiaryRev": "#66FFFFFF",
        "colorPrimaryNavQuaternaryRev": "#40FFFFFF",

        "colorSuccessBase": "#32CE99",
        "colorSuccessBg": "#3F4844",
        "colorSuccessBgActive": "#3E574B",
        "colorSuccessDisabled": "#3B795F",
        "colorSuccessBorder": "#369C77",
        "colorSuccessHover": "#58DBAB",
        "colorSuccess": "#32CE99",
        "colorSuccessActive": "#20A87F",
        "colorSuccessGradient": "#00000000",
        "colorWarningBase": "#ED7B2F",
        "colorWarningBg": "#4A443E",
        "colorWarningBgActive": "#5C4B3D",
        "colorWarningDisabled": "#865A39",
        "colorWarningBorder": "#B06634",
        "colorWarningHover": "#FA9F5A",
        "colorWarning": "#ED7B2F",
        "colorWarningActive": "#CE5C1E",
        "colorWarningGradient": "#00000000",
        "colorErrorBase": "#CC1423",
        "colorErrorBg": "#4B3E3D",
        "colorErrorBgActive": "#573A39",
        "colorErrorDisabled": "#6B3333",
        "colorErrorBorder": "#8D282B",
        "colorErrorHover": "#D93840",
        "colorError": "#CC1423",
        "colorErrorActive": "#A6081B",
        "colorErrorGradient": "#00000000",

        "colorTextBase": "#FFFFFF",
        "colorText": "#E0FFFFFF",
        "colorTextSecondary": "#A6FFFFFF",
        "colorTextTertiary": "#66FFFFFF",
        "colorTextQuaternary": "#40FFFFFF",
        "colorTextRev": "#E0000000",
        "colorTextSecondaryRev": "#A6000000",
        "colorTextTertiaryRev": "#66000000",
        "colorTextQuaternaryRev": "#40000000",

        "colorBgBase": "#000000",
        "colorFill": "#404040",
        "colorFillSecondary": "#454545",
        "colorFillTertiary": "#505050",
        "colorFillQuaternary": "#696969",
        "colorFillHover": "#EBFFFFFF",
        "colorFillSecondaryHover": "#26FFFFFF",
        "colorFillTertiaryHover": "#40FFFFFF",
        "colorFillQuaternaryHover": "#66FFFFFF",
        "colorBgContainer": "#404040",
        "colorBgContainerSecondary": "#3A3A3A",
        "colorBgContainerTertiary": "#343434",
        "colorBgContainerQuaternary": "#2E2E2E",
        "colorBgContainerQuinary": "#F2F2F2",
        "colorBgRender": "#404040",
        "colorBgRenderSecondary": "#A6404040",
        "colorBgRenderTertiary": "#66404040",
        "colorBgRenderQuaternary": "#1A404040",
        "colorBorder": "#505050",
        "colorBorderSecondary": "#5A5A5A",
        "colorDivider": "#2B2B2B",
        "colorDividerSecondary": "#282828",
        "colorDividerTertiary": "#8C8C8C",

        "OnAccent": "#000000",
        "OnAccentSecondary": "#3B444F",
        "Focus": "#3385FF",
        "Selection": "#334966",
        "Link": "#3385FF",
        "Scrim": "#80000000",
        "Overlay": "#CC000000",
        "Shadow": "#33000000",
        "Separator": "#505050"
    },
    "fonts": {
        "fontWeightRegular": 400,
        "fontWeightMedium": 500,
        "fontWeightBold": 700,
        "fontItalic": false,
        "fontLineHeight": 1.4,
        "fontLetterSpacing": 0,
        "fontSizeBase": 12
    }
}